{
  "run_id": "run_20260702_113716_019154_f6c7fc30",
  "brief_id": "frontline_study_bb4983bcde4f",
  "panel_spec": {
    "panel_type": "mainstream",
    "sample_size": 3,
    "random_seed": 17,
    "filters": {
      "synthetic_user_id": [
        "su_0003",
        "su_0002",
        "su_0001"
      ]
    },
    "preset_name": "frontline_persona_picker"
  },
  "selected_persona_ids": [
    "su_0003",
    "su_0002",
    "su_0001"
  ],
  "prompt_version": "persona-response/v1, skeptic-review/v1, sensitive-audit/v1, report-writer/v1",
  "model_version": "mock-provider/v1",
  "started_at": "2026-07-02T11:37:16+00:00",
  "finished_at": "2026-07-02T11:37:16+00:00",
  "token_estimate": 0,
  "cost_estimate": 0.0,
  "status": "completed",
  "successful_response_count": 3,
  "failed_response_count": 0,
  "error_count": 0,
  "failure_reasons": [],
  "artifact_paths": [
    "brief.json",
    "panel.json",
    "selected_personas.json",
    "sampling.json",
    "raw_responses.json",
    "stage_results.json",
    "errors.json",
    "skeptic.json",
    "audit.json",
    "aggregation.json",
    "summary.json",
    "report.json",
    "planner.json",
    "report.md"
  ]
}